            "[I 2024-07-07 01:36:44,801] Trial 25 finished with value: 0.9164835164835164 and parameters: {'solver': 'sag', 'C': 5.177965289784812, 'max_iter': 69226}. Best is trial 10 with value: 0.956043956043956.\n",
            "<ipython-input-5-515d41d3c476>:21: FutureWarning: suggest_loguniform has been deprecated in v3.0.0. This feature will be removed in v6.0.0. See https://github.com/optuna/optuna/releases/tag/v3.0.0. Use suggest_float(..., log=True) instead.\n",
            "  'C': trial.suggest_loguniform('C', 0.0001, 10),\n",
            "[I 2024-07-07 01:36:47,160] Trial 26 finished with value: 0.9164835164835164 and parameters: {'solver': 'saga', 'C': 0.692040988291725, 'max_iter': 95338}. Best is trial 10 with value: 0.956043956043956.\n",
            "<ipython-input-5-515d41d3c476>:21: FutureWarning: suggest_loguniform has been deprecated in v3.0.0. This feature will be removed in v6.0.0. See https://github.com/optuna/optuna/releases/tag/v3.0.0. Use suggest_float(..., log=True) instead.\n",
            "  'C': trial.suggest_loguniform('C', 0.0001, 10),\n",
            "[I 2024-07-07 01:36:47,351] Trial 27 finished with value: 0.9186813186813186 and parameters: {'solver': 'newton-cg', 'C': 0.00012481764185622206, 'max_iter': 52908}. Best is trial 10 with value: 0.956043956043956.\n",
            "<ipython-input-5-515d41d3c476>:21: FutureWarning: suggest_loguniform has been deprecated in v3.0.0. This feature will be removed in v6.0.0. See https://github.com/optuna/optuna/releases/tag/v3.0.0. Use suggest_float(..., log=True) instead.\n",
            "  'C': trial.suggest_loguniform('C', 0.0001, 10),\n",
            "[I 2024-07-07 01:36:47,765] Trial 28 finished with value: 0.956043956043956 and parameters: {'solver': 'newton-cg', 'C': 9.719336387034016, 'max_iter': 82070}. Best is trial 10 with value: 0.956043956043956.\n",
            "<ipython-input-5-515d41d3c476>:21: FutureWarning: suggest_loguniform has been deprecated in v3.0.0. This feature will be removed in v6.0.0. See https://github.com/optuna/optuna/releases/tag/v3.0.0. Use suggest_float(..., log=True) instead.\n",
            "  'C': trial.suggest_loguniform('C', 0.0001, 10),\n",
            "[I 2024-07-07 01:36:47,838] Trial 29 finished with value: 0.9274725274725274 and parameters: {'solver': 'liblinear', 'C': 0.012243465123930281, 'max_iter': 20650}. Best is trial 10 with value: 0.956043956043956.\n",
            "<ipython-input-5-515d41d3c476>:21: FutureWarning: suggest_loguniform has been deprecated in v3.0.0. This feature will be removed in v6.0.0. See https://github.com/optuna/optuna/releases/tag/v3.0.0. Use suggest_float(..., log=True) instead.\n",
            "  'C': trial.suggest_loguniform('C', 0.0001, 10),\n",
            "[I 2024-07-07 01:36:48,463] Trial 30 finished with value: 0.9494505494505494 and parameters: {'solver': 'newton-cg', 'C': 3.395493650225648, 'max_iter': 82072}. Best is trial 10 with value: 0.956043956043956.\n",
            "<ipython-input-5-515d41d3c476>:21: FutureWarning: suggest_loguniform has been deprecated in v3.0.0. This feature will be removed in v6.0.0. See https://github.com/optuna/optuna/releases/tag/v3.0.0. Use suggest_float(..., log=True) instead.\n",
            "  'C': trial.suggest_loguniform('C', 0.0001, 10),\n",
            "[I 2024-07-07 01:36:49,046] Trial 31 finished with value: 0.9538461538461538 and parameters: {'solver': 'newton-cg', 'C': 8.857657082778475, 'max_iter': 91955}. Best is trial 10 with value: 0.956043956043956.\n",
            "<ipython-input-5-515d41d3c476>:21: FutureWarning: suggest_loguniform has been deprecated in v3.0.0. This feature will be removed in v6.0.0. See https://github.com/optuna/optuna/releases/tag/v3.0.0. Use suggest_float(..., log=True) instead.\n",
            "  'C': trial.suggest_loguniform('C', 0.0001, 10),\n",
            "[I 2024-07-07 01:36:49,627] Trial 32 finished with value: 0.9494505494505494 and parameters: {'solver': 'newton-cg', 'C': 0.9914627228952836, 'max_iter': 84618}. Best is trial 10 with value: 0.956043956043956.\n",
            "<ipython-input-5-515d41d3c476>:21: FutureWarning: suggest_loguniform has been deprecated in v3.0.0. This feature will be removed in v6.0.0. See https://github.com/optuna/optuna/releases/tag/v3.0.0. Use suggest_float(..., log=True) instead.\n",
            "  'C': trial.suggest_loguniform('C', 0.0001, 10),\n",
            "[I 2024-07-07 01:36:50,253] Trial 33 finished with value: 0.9494505494505494 and parameters: {'solver': 'newton-cg', 'C': 3.432343206472739, 'max_iter': 68712}. Best is trial 10 with value: 0.956043956043956.\n",
            "<ipython-input-5-515d41d3c476>:21: FutureWarning: suggest_loguniform has been deprecated in v3.0.0. This feature will be removed in v6.0.0. See https://github.com/optuna/optuna/releases/tag/v3.0.0. Use suggest_float(..., log=True) instead.\n",
            "  'C': trial.suggest_loguniform('C', 0.0001, 10),\n",
            "[I 2024-07-07 01:36:50,863] Trial 34 finished with value: 0.956043956043956 and parameters: {'solver': 'newton-cg', 'C': 9.606210004860129, 'max_iter': 74068}. Best is trial 10 with value: 0.956043956043956.\n",
            "<ipython-input-5-515d41d3c476>:21: FutureWarning: suggest_loguniform has been deprecated in v3.0.0. This feature will be removed in v6.0.0. See https://github.com/optuna/optuna/releases/tag/v3.0.0. Use suggest_float(..., log=True) instead.\n",
            "  'C': trial.suggest_loguniform('C', 0.0001, 10),\n",
            "[I 2024-07-07 01:36:51,284] Trial 35 finished with value: 0.9296703296703296 and parameters: {'solver': 'newton-cg', 'C': 0.0007516930765423988, 'max_iter': 75684}. Best is trial 10 with value: 0.956043956043956.\n",
            "<ipython-input-5-515d41d3c476>:21: FutureWarning: suggest_loguniform has been deprecated in v3.0.0. This feature will be removed in v6.0.0. See https://github.com/optuna/optuna/releases/tag/v3.0.0. Use suggest_float(..., log=True) instead.\n",
            "  'C': trial.suggest_loguniform('C', 0.0001, 10),\n",
            "[I 2024-07-07 01:36:52,726] Trial 36 finished with value: 0.9406593406593405 and parameters: {'solver': 'lbfgs', 'C': 0.199096779843763, 'max_iter': 54496}. Best is trial 10 with value: 0.956043956043956.\n",
            "<ipython-input-5-515d41d3c476>:21: FutureWarning: suggest_loguniform has been deprecated in v3.0.0. This feature will be removed in v6.0.0. See https://github.com/optuna/optuna/releases/tag/v3.0.0. Use suggest_float(..., log=True) instead.\n",
            "  'C': trial.suggest_loguniform('C', 0.0001, 10),\n",
            "[I 2024-07-07 01:36:55,089] Trial 37 finished with value: 0.9164835164835164 and parameters: {'solver': 'saga', 'C': 1.9775617279086344, 'max_iter': 39543}. Best is trial 10 with value: 0.956043956043956.\n",
            "<ipython-input-5-515d41d3c476>:21: FutureWarning: suggest_loguniform has been deprecated in v3.0.0. This feature will be removed in v6.0.0. See https://github.com/optuna/optuna/releases/tag/v3.0.0. Use suggest_float(..., log=True) instead.\n",
            "  'C': trial.suggest_loguniform('C', 0.0001, 10),\n",
            "[I 2024-07-07 01:36:55,149] Trial 38 finished with value: 0.9296703296703296 and parameters: {'solver': 'liblinear', 'C': 0.061359908671319865, 'max_iter': 78565}. Best is trial 10 with value: 0.956043956043956.\n",
            "<ipython-input-5-515d41d3c476>:21: FutureWarning: suggest_loguniform has been deprecated in v3.0.0. This feature will be removed in v6.0.0. See https://github.com/optuna/optuna/releases/tag/v3.0.0. Use suggest_float(..., log=True) instead.\n",
            "  'C': trial.suggest_loguniform('C', 0.0001, 10),\n",
            "[I 2024-07-07 01:36:58,023] Trial 39 finished with value: 0.9164835164835164 and parameters: {'solver': 'sag', 'C': 4.77592034816445, 'max_iter': 94000}. Best is trial 10 with value: 0.956043956043956.\n",
            "<ipython-input-5-515d41d3c476>:21: FutureWarning: suggest_loguniform has been deprecated in v3.0.0. This feature will be removed in v6.0.0. See https://github.com/optuna/optuna/releases/tag/v3.0.0. Use suggest_float(..., log=True) instead.\n",
            "  'C': trial.suggest_loguniform('C', 0.0001, 10),\n",
            "[I 2024-07-07 01:36:58,153] Trial 40 finished with value: 0.9274725274725274 and parameters: {'solver': 'lbfgs', 'C': 0.0002926331423412693, 'max_iter': 66974}. Best is trial 10 with value: 0.956043956043956.\n",
            "<ipython-input-5-515d41d3c476>:21: FutureWarning: suggest_loguniform has been deprecated in v3.0.0. This feature will be removed in v6.0.0. See https://github.com/optuna/optuna/releases/tag/v3.0.0. Use suggest_float(..., log=True) instead.\n",
            "  'C': trial.suggest_loguniform('C', 0.0001, 10),\n",
            "[I 2024-07-07 01:36:58,535] Trial 41 finished with value: 0.956043956043956 and parameters: {'solver': 'newton-cg', 'C': 9.392369660724826, 'max_iter': 86239}. Best is trial 10 with value: 0.956043956043956.\n",
            "<ipython-input-5-515d41d3c476>:21: FutureWarning: suggest_loguniform has been deprecated in v3.0.0. This feature will be removed in v6.0.0. See https://github.com/optuna/optuna/releases/tag/v3.0.0. Use suggest_float(..., log=True) instead.\n",
            "  'C': trial.suggest_loguniform('C', 0.0001, 10),\n",
            "[I 2024-07-07 01:36:58,941] Trial 42 finished with value: 0.956043956043956 and parameters: {'solver': 'newton-cg', 'C': 9.378194062002594, 'max_iter': 73472}. Best is trial 10 with value: 0.956043956043956.\n",
            "<ipython-input-5-515d41d3c476>:21: FutureWarning: suggest_loguniform has been deprecated in v3.0.0. This feature will be removed in v6.0.0. See https://github.com/optuna/optuna/releases/tag/v3.0.0. Use suggest_float(..., log=True) instead.\n",
            "  'C': trial.suggest_loguniform('C', 0.0001, 10),\n",
            "[I 2024-07-07 01:36:59,331] Trial 43 finished with value: 0.9516483516483516 and parameters: {'solver': 'newton-cg', 'C': 4.449549456785071, 'max_iter': 85518}. Best is trial 10 with value: 0.956043956043956.\n",
            "<ipython-input-5-515d41d3c476>:21: FutureWarning: suggest_loguniform has been deprecated in v3.0.0. This feature will be removed in v6.0.0. See https://github.com/optuna/optuna/releases/tag/v3.0.0. Use suggest_float(..., log=True) instead.\n",
            "  'C': trial.suggest_loguniform('C', 0.0001, 10),\n",
            "[I 2024-07-07 01:36:59,738] Trial 44 finished with value: 0.9494505494505494 and parameters: {'solver': 'newton-cg', 'C': 2.0088031678278417, 'max_iter': 79417}. Best is trial 10 with value: 0.956043956043956.\n",
            "<ipython-input-5-515d41d3c476>:21: FutureWarning: suggest_loguniform has been deprecated in v3.0.0. This feature will be removed in v6.0.0. See https://github.com/optuna/optuna/releases/tag/v3.0.0. Use suggest_float(..., log=True) instead.\n",
            "  'C': trial.suggest_loguniform('C', 0.0001, 10),\n",
            "[I 2024-07-07 01:37:00,178] Trial 45 finished with value: 0.956043956043956 and parameters: {'solver': 'newton-cg', 'C': 9.945232605075347, 'max_iter': 99169}. Best is trial 10 with value: 0.956043956043956.\n",
            "<ipython-input-5-515d41d3c476>:21: FutureWarning: suggest_loguniform has been deprecated in v3.0.0. This feature will be removed in v6.0.0. See https://github.com/optuna/optuna/releases/tag/v3.0.0. Use suggest_float(..., log=True) instead.\n",
            "  'C': trial.suggest_loguniform('C', 0.0001, 10),\n",
            "[I 2024-07-07 01:37:00,597] Trial 46 finished with value: 0.9494505494505494 and parameters: {'solver': 'newton-cg', 'C': 2.88942734052762, 'max_iter': 93772}. Best is trial 10 with value: 0.956043956043956.\n",
            "<ipython-input-5-515d41d3c476>:21: FutureWarning: suggest_loguniform has been deprecated in v3.0.0. This feature will be removed in v6.0.0. See https://github.com/optuna/optuna/releases/tag/v3.0.0. Use suggest_float(..., log=True) instead.\n",
            "  'C': trial.suggest_loguniform('C', 0.0001, 10),\n",
            "[I 2024-07-07 01:37:00,998] Trial 47 finished with value: 0.9516483516483516 and parameters: {'solver': 'newton-cg', 'C': 5.483215668419779, 'max_iter': 85374}. Best is trial 10 with value: 0.956043956043956.\n",
            "<ipython-input-5-515d41d3c476>:21: FutureWarning: suggest_loguniform has been deprecated in v3.0.0. This feature will be removed in v6.0.0. See https://github.com/optuna/optuna/releases/tag/v3.0.0. Use suggest_float(..., log=True) instead.\n",
            "  'C': trial.suggest_loguniform('C', 0.0001, 10),\n",
            "[I 2024-07-07 01:37:02,756] Trial 48 finished with value: 0.9494505494505494 and parameters: {'solver': 'lbfgs', 'C': 0.8357806759735047, 'max_iter': 73171}. Best is trial 10 with value: 0.956043956043956.\n",
            "<ipython-input-5-515d41d3c476>:21: FutureWarning: suggest_loguniform has been deprecated in v3.0.0. This feature will be removed in v6.0.0. See https://github.com/optuna/optuna/releases/tag/v3.0.0. Use suggest_float(..., log=True) instead.\n",
            "  'C': trial.suggest_loguniform('C', 0.0001, 10),\n",
            "[I 2024-07-07 01:37:06,770] Trial 49 finished with value: 0.9164835164835164 and parameters: {'solver': 'saga', 'C': 0.38550482962013766, 'max_iter': 78157}. Best is trial 10 with value: 0.956043956043956.\n",
            "<ipython-input-5-515d41d3c476>:21: FutureWarning: suggest_loguniform has been deprecated in v3.0.0. This feature will be removed in v6.0.0. See https://github.com/optuna/optuna/releases/tag/v3.0.0. Use suggest_float(..., log=True) instead.\n",
            "  'C': trial.suggest_loguniform('C', 0.0001, 10),\n",
            "[I 2024-07-07 01:37:07,246] Trial 50 finished with value: 0.9494505494505494 and parameters: {'solver': 'newton-cg', 'C': 1.6978078721300796, 'max_iter': 29003}. Best is trial 10 with value: 0.956043956043956.\n",
            "<ipython-input-5-515d41d3c476>:21: FutureWarning: suggest_loguniform has been deprecated in v3.0.0. This feature will be removed in v6.0.0. See https://github.com/optuna/optuna/releases/tag/v3.0.0. Use suggest_float(..., log=True) instead.\n",
            "  'C': trial.suggest_loguniform('C', 0.0001, 10),\n",
            "[I 2024-07-07 01:37:07,683] Trial 51 finished with value: 0.956043956043956 and parameters: {'solver': 'newton-cg', 'C': 9.793832438463983, 'max_iter': 72706}. Best is trial 10 with value: 0.956043956043956.\n",
            "<ipython-input-5-515d41d3c476>:21: FutureWarning: suggest_loguniform has been deprecated in v3.0.0. This feature will be removed in v6.0.0. See https://github.com/optuna/optuna/releases/tag/v3.0.0. Use suggest_float(..., log=True) instead.\n",
            "  'C': trial.suggest_loguniform('C', 0.0001, 10),\n",
            "[I 2024-07-07 01:37:08,097] Trial 52 finished with value: 0.9538461538461538 and parameters: {'solver': 'newton-cg', 'C': 6.319321513818858, 'max_iter': 82883}. Best is trial 10 with value: 0.956043956043956.\n",
            "<ipython-input-5-515d41d3c476>:21: FutureWarning: suggest_loguniform has been deprecated in v3.0.0. This feature will be removed in v6.0.0. See https://github.com/optuna/optuna/releases/tag/v3.0.0. Use suggest_float(..., log=True) instead.\n",
            "  'C': trial.suggest_loguniform('C', 0.0001, 10),\n",
            "[I 2024-07-07 01:37:08,522] Trial 53 finished with value: 0.9494505494505494 and parameters: {'solver': 'newton-cg', 'C': 3.6282406468167743, 'max_iter': 65975}. Best is trial 10 with value: 0.956043956043956.\n",
            "<ipython-input-5-515d41d3c476>:21: FutureWarning: suggest_loguniform has been deprecated in v3.0.0. This feature will be removed in v6.0.0. See https://github.com/optuna/optuna/releases/tag/v3.0.0. Use suggest_float(..., log=True) instead.\n",
            "  'C': trial.suggest_loguniform('C', 0.0001, 10),\n",
            "[I 2024-07-07 01:37:08,938] Trial 54 finished with value: 0.9538461538461538 and parameters: {'solver': 'newton-cg', 'C': 6.355055806924227, 'max_iter': 91873}. Best is trial 10 with value: 0.956043956043956.\n",
            "<ipython-input-5-515d41d3c476>:21: FutureWarning: suggest_loguniform has been deprecated in v3.0.0. This feature will be removed in v6.0.0. See https://github.com/optuna/optuna/releases/tag/v3.0.0. Use suggest_float(..., log=True) instead.\n",
            "  'C': trial.suggest_loguniform('C', 0.0001, 10),\n",
            "[I 2024-07-07 01:37:09,005] Trial 55 finished with value: 0.9472527472527472 and parameters: {'solver': 'liblinear', 'C': 2.827703039659997, 'max_iter': 75246}. Best is trial 10 with value: 0.956043956043956.\n",
            "<ipython-input-5-515d41d3c476>:21: FutureWarning: suggest_loguniform has been deprecated in v3.0.0. This feature will be removed in v6.0.0. See https://github.com/optuna/optuna/releases/tag/v3.0.0. Use suggest_float(..., log=True) instead.\n",
            "  'C': trial.suggest_loguniform('C', 0.0001, 10),\n",
            "[I 2024-07-07 01:37:11,850] Trial 56 finished with value: 0.9164835164835164 and parameters: {'solver': 'sag', 'C': 0.11994363476796521, 'max_iter': 99891}. Best is trial 10 with value: 0.956043956043956.\n",
            "<ipython-input-5-515d41d3c476>:21: FutureWarning: suggest_loguniform has been deprecated in v3.0.0. This feature will be removed in v6.0.0. See https://github.com/optuna/optuna/releases/tag/v3.0.0. Use suggest_float(..., log=True) instead.\n",
            "  'C': trial.suggest_loguniform('C', 0.0001, 10),\n",
            "[I 2024-07-07 01:37:12,251] Trial 57 finished with value: 0.9538461538461538 and parameters: {'solver': 'newton-cg', 'C': 6.430330462014952, 'max_iter': 60656}. Best is trial 10 with value: 0.956043956043956.\n",
            "<ipython-input-5-515d41d3c476>:21: FutureWarning: suggest_loguniform has been deprecated in v3.0.0. This feature will be removed in v6.0.0. See https://github.com/optuna/optuna/releases/tag/v3.0.0. Use suggest_float(..., log=True) instead.\n",
            "  'C': trial.suggest_loguniform('C', 0.0001, 10),\n",
            "[I 2024-07-07 01:37:12,660] Trial 58 finished with value: 0.956043956043956 and parameters: {'solver': 'newton-cg', 'C': 9.932365921203527, 'max_iter': 86458}. Best is trial 10 with value: 0.956043956043956.\n",
            "<ipython-input-5-515d41d3c476>:21: FutureWarning: suggest_loguniform has been deprecated in v3.0.0. This feature will be removed in v6.0.0. See https://github.com/optuna/optuna/releases/tag/v3.0.0. Use suggest_float(..., log=True) instead.\n",
            "  'C': trial.suggest_loguniform('C', 0.0001, 10),\n",
            "[I 2024-07-07 01:37:13,052] Trial 59 finished with value: 0.9494505494505494 and parameters: {'solver': 'newton-cg', 'C': 1.4731139306624694, 'max_iter': 96608}. Best is trial 10 with value: 0.956043956043956.\n",
            "<ipython-input-5-515d41d3c476>:21: FutureWarning: suggest_loguniform has been deprecated in v3.0.0. This feature will be removed in v6.0.0. See https://github.com/optuna/optuna/releases/tag/v3.0.0. Use suggest_float(..., log=True) instead.\n",
            "  'C': trial.suggest_loguniform('C', 0.0001, 10),\n",
            "[I 2024-07-07 01:37:13,462] Trial 60 finished with value: 0.9494505494505494 and parameters: {'solver': 'newton-cg', 'C': 2.1257132365588545, 'max_iter': 79965}. Best is trial 10 with value: 0.956043956043956.\n",
            "<ipython-input-5-515d41d3c476>:21: FutureWarning: suggest_loguniform has been deprecated in v3.0.0. This feature will be removed in v6.0.0. See https://github.com/optuna/optuna/releases/tag/v3.0.0. Use suggest_float(..., log=True) instead.\n",
            "  'C': trial.suggest_loguniform('C', 0.0001, 10),\n",
            "[I 2024-07-07 01:37:13,876] Trial 61 finished with value: 0.956043956043956 and parameters: {'solver': 'newton-cg', 'C': 9.692976848128273, 'max_iter': 99853}. Best is trial 10 with value: 0.956043956043956.\n",
            "<ipython-input-5-515d41d3c476>:21: FutureWarning: suggest_loguniform has been deprecated in v3.0.0. This feature will be removed in v6.0.0. See https://github.com/optuna/optuna/releases/tag/v3.0.0. Use suggest_float(..., log=True) instead.\n",
            "  'C': trial.suggest_loguniform('C', 0.0001, 10),\n",
