            "[I 2024-07-07 01:37:14,282] Trial 62 finished with value: 0.9516483516483516 and parameters: {'solver': 'newton-cg', 'C': 4.873749156092089, 'max_iter': 91881}. Best is trial 10 with value: 0.956043956043956.\n"
          ]
        },
        {
          "output_type": "stream",
          "name": "stdout",
          "text": [
            "params: {'solver': 'newton-cg', 'C': 9.511300132701983, 'max_iter': 99099}\n"
          ]
        }
      ]
    },
    {
      "cell_type": "code",
      "source": [
        "study.best_params"
      ],
      "metadata": {
        "id": "NHAEqMGi1elJ",
        "outputId": "0560aac8-83f0-46e8-fc9b-04a06a18b7a2",
        "colab": {
          "base_uri": "https://localhost:8080/"
        }
      },
      "execution_count": 6,
      "outputs": [
        {
          "output_type": "execute_result",
          "data": {
            "text/plain": [
              "{'solver': 'newton-cg', 'C': 9.511300132701983, 'max_iter': 99099}"
            ]
          },
          "metadata": {},
          "execution_count": 6
        }
      ]
    },
    {
      "cell_type": "code",
      "source": [
        "print(study.best_params['solver'])\n",
        "print(study.best_params['max_iter'])\n",
        "print(study.best_params['C'])"
      ],
      "metadata": {
        "id": "NqtgQH_D1q-Y",
        "outputId": "fd961133-23b6-464a-ca0b-30f700a4fdcb",
        "colab": {
          "base_uri": "https://localhost:8080/"
        }
      },
      "execution_count": 7,
      "outputs": [
        {
          "output_type": "stream",
          "name": "stdout",
          "text": [
            "newton-cg\n",
            "99099\n",
            "9.511300132701983\n"
          ]
        }
      ]
    },
    {
      "cell_type": "code",
      "source": [
        "print(study.best_value)"
      ],
      "metadata": {
        "id": "343scXX51xhn",
        "outputId": "631b02d1-a265-4080-e0ec-5cc7d52e9461",
        "colab": {
          "base_uri": "https://localhost:8080/"
        }
      },
      "execution_count": 8,
      "outputs": [
        {
          "output_type": "stream",
          "name": "stdout",
          "text": [
            "0.956043956043956\n"
          ]
        }
      ]
    },
    {
      "cell_type": "code",
      "source": [
        "from sklearn.metrics import confusion_matrix, accuracy_score\n",
        "from sklearn.metrics import precision_score, recall_score\n",
        "\n",
        "model = LogisticRegression(\n",
        "    # ハイパーパラメータ探索で特定した値を設定\n",
        "    solver = study.best_params['solver'],\n",
        "    C = study.best_params['C'],\n",
        "    max_iter = study.best_params['max_iter']\n",
        ")\n",
        "\n",
        "model.fit(X_train, y_train)\n",
        "pred = model.predict(X_test)\n",
        "# 正解率の出力\n",
        "print(\"Accuracy: {:.5f}\".format(100 * accuracy_score(y_test, pred)))\n",
        "\n",
        "# 混同行列の出力\n",
        "print(confusion_matrix(y_test, pred))\n",
        "\n",
        "# 適合率\n",
        "print(\"Precision: {:.5f}\".format(100 * precision_score(y_test, pred)))\n",
        "# 再現率\n",
        "print(\"Recall: {:.5f}\".format(100 * recall_score(y_test, pred)))"
      ],
      "metadata": {
        "id": "teFtbejN11X3",
        "outputId": "1d63e35f-dcad-445b-a2b3-a9b7560d451b",
        "colab": {
          "base_uri": "https://localhost:8080/"
        }
      },
      "execution_count": 10,
      "outputs": [
        {
          "output_type": "stream",
          "name": "stdout",
          "text": [
            "Accuracy: 98.24561\n",
            "[[73  0]\n",
            " [ 2 39]]\n",
            "Precision: 100.00000\n",
            "Recall: 95.12195\n"
          ]
        }
      ]
    }
  ]
}